{
  "$schema": "http://json-schema.org/draft-06/schema",
  "type": "object",
  "properties": {
    "version": {
      "type": "number"
    },
    "success": {
      "type": "boolean"
    },
    "reason": {},
    "content": {
      "type": "array",
      "items": {
        "type": "object",
        "properties": {
          "playbook_name": {
            "type": "string"
          },
          "success": {
            "type": "boolean"
          },
          "id": {
            "type": "integer"
          }
        }
      }
    },
    "raw": {},
    "inputs": {
      "type": "object",
      "properties": {
        "pbm_activation_fields": {
          "type": "boolean"
        },
        "pbm_app_name": {},
        "pbm_playbook_name": {
          "type": "string"
        },
        "pbm_function_names": {
          "type": "string"
        },
        "pbm_activation_type": {
          "type": "string"
        },
        "pbm_playbook_type": {
          "type": "string"
        },
        "pbm_add_to_same_playbook": {
          "type": "boolean"
        }
      }
    },
    "metrics": {
      "type": "object",
      "properties": {
        "version": {
          "type": "string"
        },
        "package": {
          "type": "string"
        },
        "package_version": {
          "type": "string"
        },
        "host": {
          "type": "string"
        },
        "execution_time_ms": {
          "type": "integer"
        },
        "timestamp": {
          "type": "string"
        }
      }
    }
  }
}