{
  "version": 2.0,
  "success": true,
  "reason": null,
  "content": [
    {
      "playbook_name": "make-7 for make_playbook",
      "success": true,
      "id": 85
    }
  ],
  "raw": null,
  "inputs": {
    "pbm_activation_fields": false,
    "pbm_app_name": null,
    "pbm_playbook_name": "make-7",
    "pbm_function_names": "make_playbook",
    "pbm_activation_type": "Manual",
    "pbm_playbook_type": "incident",
    "pbm_add_to_same_playbook": false
  },
  "metrics": {
    "version": "1.0",
    "package": "fn-playbook-maker",
    "package_version": "1.0.0",
    "host": "local",
    "execution_time_ms": 5732,
    "timestamp": "2022-06-09 15:12:28"
  }
}